{
  "schemaVersion": 2,
  "name": "form-survey-builder",
  "path": "skills/forms-surveys/form-survey-builder",
  "version": "0.18.2",
  "stage": "experimental",
  "scenarioId": "build-form-or-survey",
  "origin": "xopc-adapted",
  "license": "Apache-2.0",
  "owner": "XOPC Skills Team",
  "source": "skills/forms-surveys/form-survey-builder/SOURCE.json",
  "localizations": {
    "en": {
      "displayName": "Form and Survey Builder",
      "description": "Design a form or survey from a clear collection goal, including concise questions, answer types, branching, validation, privacy notes, and a response schema."
    },
    "zh-CN": {
      "displayName": "表单与问卷设计",
      "description": "根据收集目标设计精简的问题、答案类型、分支、校验、隐私提示和响应结构。"
    }
  },
  "compatibility": {
    "agents": [
      "Codex",
      "Claude Code",
      "Cursor",
      "Gemini CLI"
    ],
    "runtime": [
      "Supplied artifacts or relevant connected sources"
    ],
    "os": [
      "macOS",
      "Linux",
      "Windows"
    ]
  },
  "qualityGates": {
    "Q0": "scenario-and-upstream-evidence",
    "Q1": "passed",
    "Q2": "passed",
    "Q3": "passed",
    "Q4": "fixtures-ready",
    "Q5": "fixtures-ready",
    "Q6": "declared",
    "Q7": "experimental-release"
  },
  "stableBlockers": [
    "Run realistic task baseline",
    "Measure error and omission rates",
    "Collect domain-review feedback"
  ]
}
