{
  "schemaVersion": 2,
  "name": "directory-submissions",
  "path": "skills/growth-distribution/directory-submissions",
  "version": "0.18.0",
  "stage": "experimental",
  "scenarioId": "market-growth-distribution",
  "origin": "xopc-adapted",
  "license": "MIT",
  "owner": "XOPC Skills Team",
  "source": "skills/growth-distribution/directory-submissions/SOURCE.json",
  "localizations": {
    "en": {
      "displayName": "Directory Submissions",
      "description": "Submit their product to startup, SaaS, AI, agent, MCP, no-code, or review directories for backlinks, domain rating, and discovery."
    },
    "zh-CN": {
      "displayName": "目录提交",
      "description": "规划产品在行业目录和评测平台的提交材料、优先级、进度与效果跟踪。"
    }
  },
  "compatibility": {
    "agents": [
      "Codex",
      "Claude Code",
      "Cursor",
      "Gemini CLI"
    ],
    "runtime": [
      "No helper runtime required; web, analytics, media, or account tools are optional and task-dependent"
    ],
    "os": [
      "macOS",
      "Linux",
      "Windows"
    ]
  },
  "qualityGates": {
    "Q0": "provisional",
    "Q1": "passed",
    "Q2": "passed",
    "Q3": "passed",
    "Q4": "fixtures-ready",
    "Q5": "fixtures-ready",
    "Q6": "declared",
    "Q7": "experimental-release"
  },
  "stableBlockers": [
    "Run blind review on three representative real tasks",
    "Measure unsupported-claim and routing-error rates",
    "Validate platform-specific guidance and external-action recovery"
  ]
}
