{
  "schemaVersion": 2,
  "name": "employee-onboarding-planning",
  "path": "skills/employee-operations/employee-onboarding-planning",
  "version": "0.18.2",
  "stage": "experimental",
  "scenarioId": "plan-employee-onboarding",
  "origin": "xopc-original",
  "license": "MIT",
  "owner": "XOPC Skills Team",
  "localizations": {
    "en": {
      "displayName": "Employee Onboarding Planning",
      "description": "Coordinate onboarding for an already selected employee using supplied role expectations and company procedures."
    },
    "zh-CN": {
      "displayName": "员工入职规划",
      "description": "根据已确定岗位和公司材料生成有依赖、负责人和验收证据的入职计划。"
    }
  },
  "compatibility": {
    "agents": [
      "Codex",
      "Claude Code",
      "Cursor",
      "Gemini CLI"
    ],
    "runtime": [
      "Supplied role and company onboarding material"
    ],
    "os": [
      "macOS",
      "Linux",
      "Windows"
    ]
  },
  "qualityGates": {
    "Q0": "scenario-and-market-evidence",
    "Q1": "passed",
    "Q2": "source-reviewed-original",
    "Q3": "self-reviewed-boundaries",
    "Q4": "fixtures-ready",
    "Q5": "fixtures-ready",
    "Q6": "declared",
    "Q7": "experimental-release"
  },
  "stableBlockers": [
    "Run realistic task baseline and held-out trigger evaluation",
    "Complete independent domain review",
    "Verify target-product runtime compatibility"
  ]
}
