{
  "schemaVersion": 2,
  "name": "public-relations",
  "path": "skills/earned-media/public-relations",
  "version": "0.18.0",
  "stage": "experimental",
  "scenarioId": "market-earned-media",
  "origin": "xopc-adapted",
  "license": "MIT",
  "owner": "XOPC Skills Team",
  "source": "skills/earned-media/public-relations/SOURCE.json",
  "localizations": {
    "en": {
      "displayName": "Public Relations & Earned Media",
      "description": "Help with public relations, earned media, press coverage, journalist outreach, or media strategy (not pull requests)."
    },
    "zh-CN": {
      "displayName": "准备公共关系材料",
      "description": "把可证实的新闻价值转化为媒体名单、pitch 和发布材料。"
    }
  },
  "compatibility": {
    "agents": [
      "Codex",
      "Claude Code",
      "Cursor",
      "Gemini CLI"
    ],
    "runtime": [
      "No helper runtime required; web, analytics, media, or account tools are optional and task-dependent"
    ],
    "os": [
      "macOS",
      "Linux",
      "Windows"
    ]
  },
  "qualityGates": {
    "Q0": "provisional",
    "Q1": "passed",
    "Q2": "passed",
    "Q3": "passed",
    "Q4": "fixtures-ready",
    "Q5": "fixtures-ready",
    "Q6": "declared",
    "Q7": "experimental-release"
  },
  "stableBlockers": [
    "Run blind review on three representative real tasks",
    "Measure unsupported-claim and routing-error rates",
    "Validate platform-specific guidance and external-action recovery"
  ]
}
