{"schemaVersion":2,"name":"competitive-intelligence","path":"skills/market-intelligence/competitive-intelligence","version":"0.18.2","stage":"experimental","scenarioId":"build-competitive-intelligence","origin":"xopc-original","license":"MIT","owner":"XOPC Skills Team","localizations":{"en":{"displayName":"Competitive Intelligence","description":"Build current, source-traceable competitor intelligence for a specific product, market, sales, or strategy decision."},"zh-CN":{"displayName":"竞品情报","description":"基于注明来源和日期的信息比较竞品，为具体产品、市场、销售或战略决策提供判断。"}},"compatibility":{"agents":["Codex","Claude Code","Cursor","Gemini CLI"],"runtime":["Current web research and optional internal evidence"],"os":["macOS","Linux","Windows"]},"qualityGates":{"Q0":"scenario-and-market-evidence","Q1":"passed","Q2":"passed","Q3":"passed","Q4":"fixtures-ready","Q5":"fixtures-ready","Q6":"declared","Q7":"experimental-release"},"stableBlockers":["Run dated competitor baseline","Measure stale-fact and false-equivalence rate","Complete product marketing review"]}
