{"schemaVersion":2,"name":"academic-writing-coach","path":"skills/academic-writing/academic-writing-coach","version":"0.18.2","stage":"experimental","scenarioId":"coach-academic-writing","origin":"xopc-original","license":"MIT","owner":"XOPC Skills Team","localizations":{"en":{"displayName":"Academic Writing Coach","description":"Coach a student or researcher through topic refinement, research questions, outlines, arguments, literature synthesis, revision, citation hygiene, and defense preparation."},"zh-CN":{"displayName":"学术写作辅导","description":"围绕选题、研究问题、论证、结构、文献和引用提供修改建议，同时保留学生的作者责任。"}},"compatibility":{"agents":["Codex","Claude Code","Cursor","Gemini CLI"],"runtime":["Supplied assignment rules, manuscript, evidence, and citation sources"],"os":["macOS","Linux","Windows"]},"qualityGates":{"Q0":"scenario-and-market-evidence","Q1":"passed","Q2":"passed","Q3":"passed","Q4":"fixtures-ready","Q5":"fixtures-ready","Q6":"declared","Q7":"experimental-release"},"stableBlockers":["Run discipline-diverse baseline","Measure fabricated citation and authorship errors","Complete academic-integrity review"]}
