{
  "schemaVersion": 2,
  "name": "decision-prototype",
  "path": "skills/product-discovery/decision-prototype",
  "version": "0.18.3",
  "stage": "experimental",
  "scenarioId": "prototype-product-decision",
  "origin": "xopc-adapted",
  "license": "MIT",
  "owner": "XOPC Skills Team",
  "source": "skills/product-discovery/decision-prototype/SOURCE.json",
  "localizations": {
    "en": {
      "displayName": "Decision Prototype",
      "description": "Build a deliberately throwaway interactive prototype to answer one product, workflow, state-model, or interface decision before production implementation."
    },
    "zh-CN": {
      "displayName": "决策原型",
      "description": "以最小一次性原型回答一个高价值决策问题并记录证据与结论。"
    }
  },
  "compatibility": {
    "agents": [
      "Codex",
      "Claude Code",
      "Cursor",
      "Gemini CLI"
    ],
    "runtime": [
      "Git repository or supplied project artifacts"
    ],
    "os": [
      "macOS",
      "Linux",
      "Windows"
    ]
  },
  "qualityGates": {
    "Q0": "scenario-and-upstream-evidence",
    "Q1": "passed",
    "Q2": "passed",
    "Q3": "passed",
    "Q4": "fixtures-ready",
    "Q5": "fixtures-ready",
    "Q6": "declared",
    "Q7": "experimental-release"
  },
  "stableBlockers": [
    "Run realistic task baseline",
    "Measure error and omission rates",
    "Collect domain-review feedback"
  ]
}
