{
  "schemaVersion": 2,
  "name": "events",
  "path": "skills/launch-marketing/events",
  "version": "0.18.2",
  "stage": "experimental",
  "scenarioId": "market-launch-marketing",
  "origin": "xopc-adapted",
  "license": "MIT",
  "owner": "XOPC Skills Team",
  "source": "skills/launch-marketing/events/SOURCE.json",
  "localizations": {
    "en": {
      "displayName": "Event Marketing",
      "description": "Plan, run, sponsor, speak at, or get pipeline from events — webinars, conferences, trade shows, meetups, dinners, workshops, virtual summits, or user conferences."
    },
    "zh-CN": {
      "displayName": "营销活动策划",
      "description": "规划线上或线下活动的目标、形式、执行、跟进和投入产出衡量。"
    }
  },
  "compatibility": {
    "agents": [
      "Codex",
      "Claude Code",
      "Cursor",
      "Gemini CLI"
    ],
    "runtime": [
      "No helper runtime required; web, analytics, media, or account tools are optional and task-dependent"
    ],
    "os": [
      "macOS",
      "Linux",
      "Windows"
    ]
  },
  "qualityGates": {
    "Q0": "provisional",
    "Q1": "passed",
    "Q2": "passed",
    "Q3": "passed",
    "Q4": "fixtures-ready",
    "Q5": "fixtures-ready",
    "Q6": "declared",
    "Q7": "experimental-release"
  },
  "stableBlockers": [
    "Run blind review on three representative real tasks",
    "Measure unsupported-claim and routing-error rates",
    "Validate platform-specific guidance and external-action recovery"
  ]
}
