{
  "schemaVersion": 2,
  "name": "influencer-marketing",
  "path": "skills/partner-marketing/influencer-marketing",
  "version": "0.18.1",
  "stage": "experimental",
  "scenarioId": "market-partner-marketing",
  "origin": "xopc-adapted",
  "license": "MIT",
  "owner": "XOPC Skills Team",
  "source": "skills/partner-marketing/influencer-marketing/SOURCE.json",
  "localizations": {
    "en": {
      "displayName": "Influencer & Creator Marketing",
      "description": "Run influencer, creator, or ambassador partnerships to promote their product — finding and vetting partners, structuring deals, briefing creators, disclosure compliance, and measuring ROI."
    },
    "zh-CN": {
      "displayName": "达人营销",
      "description": "筛选和评估创作者，设计合作方式、内容简报、披露要求和效果衡量。"
    }
  },
  "compatibility": {
    "agents": [
      "Codex",
      "Claude Code",
      "Cursor",
      "Gemini CLI"
    ],
    "runtime": [
      "No helper runtime required; web, analytics, media, or account tools are optional and task-dependent"
    ],
    "os": [
      "macOS",
      "Linux",
      "Windows"
    ]
  },
  "qualityGates": {
    "Q0": "provisional",
    "Q1": "passed",
    "Q2": "passed",
    "Q3": "passed",
    "Q4": "fixtures-ready",
    "Q5": "fixtures-ready",
    "Q6": "declared",
    "Q7": "experimental-release"
  },
  "stableBlockers": [
    "Run blind review on three representative real tasks",
    "Measure unsupported-claim and routing-error rates",
    "Validate platform-specific guidance and external-action recovery"
  ]
}
