{
  "schemaVersion": 2,
  "name": "data-visualization-report",
  "path": "skills/office-data/data-visualization-report",
  "version": "0.18.1",
  "stage": "experimental",
  "scenarioId": "create-data-visualization-report",
  "origin": "xopc-adapted",
  "license": "Apache-2.0",
  "owner": "XOPC Skills Team",
  "source": "skills/office-data/data-visualization-report/SOURCE.json",
  "localizations": {
    "en": {
      "displayName": "Data Visualization Report",
      "description": "Turn a validated dataset and business question into an accurate, accessible visualization and concise insight report."
    },
    "zh-CN": {
      "displayName": "从可信数据生成可视化报告",
      "description": "交付数据验证、图表选择、可访问渲染、来源说明和结论一致的可视化报告。"
    }
  },
  "compatibility": {
    "agents": [
      "Codex",
      "Claude Code",
      "Cursor",
      "Gemini CLI"
    ],
    "runtime": [
      "Supplied artifacts or relevant connected sources"
    ],
    "os": [
      "macOS",
      "Linux",
      "Windows"
    ]
  },
  "qualityGates": {
    "Q0": "scenario-and-upstream-evidence",
    "Q1": "passed",
    "Q2": "passed",
    "Q3": "passed",
    "Q4": "fixtures-ready",
    "Q5": "fixtures-ready",
    "Q6": "declared",
    "Q7": "experimental-release"
  },
  "stableBlockers": [
    "Run realistic task baseline",
    "Measure error and omission rates",
    "Collect domain-review feedback"
  ]
}
