{"schemaVersion":2,"name":"email-reply-drafting","path":"skills/email-productivity/email-reply-drafting","version":"0.18.2","stage":"experimental","scenarioId":"draft-email-reply","origin":"xopc-adapted","license":"MIT","owner":"XOPC Skills Team","source":"skills/email-productivity/email-reply-drafting/SOURCE.json","localizations":{"en":{"displayName":"Email Reply Drafting","description":"Draft a grounded reply to a selected email message or thread, preserving facts, commitments, audience, and tone."},"zh-CN":{"displayName":"邮件回复起草","description":"根据完整邮件线程起草回复，准确处理收件人、事实、承诺和语气，并保留发送确认。"}},"compatibility":{"agents":["Codex","Claude Code","Cursor","Gemini CLI"],"runtime":["Connected mailbox or supplied email thread"],"os":["macOS","Linux","Windows"]},"qualityGates":{"Q0":"scenario-and-upstream-evidence","Q1":"passed","Q2":"passed","Q3":"passed","Q4":"fixtures-ready","Q5":"fixtures-ready","Q6":"declared","Q7":"experimental-release"},"stableBlockers":["Measure factual preservation","Test reply-all judgment","Evaluate cross-language tone"]}
