{"schemaVersion":2,"name":"sop-authoring","path":"skills/business-operations/sop-authoring","version":"0.18.1","stage":"experimental","scenarioId":"author-standard-operating-procedure","origin":"xopc-original","license":"MIT","owner":"XOPC Skills Team","localizations":{"en":{"displayName":"SOP Authoring","description":"Convert observed work and controls into a usable, governed standard operating procedure."},"zh-CN":{"displayName":"将真实流程整理为可执行可治理的 SOP","description":"交付角色、步骤、控制、异常、证据和版本责任清楚且经过走查的 SOP。"}},"compatibility":{"agents":["Codex","Claude Code","Cursor","Gemini CLI"],"runtime":["Supplied process evidence and policies"],"os":["macOS","Linux","Windows"]},"qualityGates":{"Q0":"scenario-and-market-evidence","Q1":"passed","Q2":"passed","Q3":"passed","Q4":"fixtures-ready","Q5":"fixtures-ready","Q6":"declared","Q7":"experimental-release"},"stableBlockers":["Run operator walkthrough baseline","Measure unusable-step omissions","Complete process-owner review"]}
