{"schemaVersion":2,"name":"spreadsheet-workbench","path":"skills/office-data/spreadsheet-workbench","version":"0.18.1","stage":"experimental","scenarioId":"work-with-spreadsheet","origin":"xopc-adapted","license":"MIT","owner":"XOPC Skills Team","source":"skills/office-data/spreadsheet-workbench/SOURCE.json","localizations":{"en":{"displayName":"Spreadsheet Workbench","description":"Create, analyze, edit, format, or validate spreadsheet files such as XLSX, XLSM, CSV, and TSV with formula and workbook-integrity checks."},"zh-CN":{"displayName":"分析、创建或编辑保持完整性的电子表格","description":"交付公式、格式、结构、关键总计和兼容性经过验证的电子表格。"}},"compatibility":{"agents":["Codex","Claude Code","Cursor","Gemini CLI"],"runtime":["Spreadsheet parsing, editing, recalculation, and preview tools"],"os":["macOS","Linux","Windows"]},"qualityGates":{"Q0":"scenario-and-upstream-evidence","Q1":"passed","Q2":"passed","Q3":"passed","Q4":"fixtures-ready","Q5":"fixtures-ready","Q6":"declared","Q7":"experimental-release"},"stableBlockers":["Test XLSM preservation","Validate pivots and external links","Compare formula engines"]}
