{
  "schemaVersion": 2,
  "name": "explainer-video-production",
  "path": "skills/media-production/explainer-video-production",
  "version": "0.18.3",
  "stage": "experimental",
  "scenarioId": "produce-explainer-video",
  "origin": "xopc-adapted",
  "license": "MIT",
  "owner": "XOPC Skills Team",
  "source": "skills/media-production/explainer-video-production/SOURCE.json",
  "localizations": {
    "en": {
      "displayName": "Explainer Video Production",
      "description": "Turn a bounded topic, source, or product explanation into a coherent explainer-video package with factual script, storyboard, narration and visual plan, production specification, and render QA."
    },
    "zh-CN": {
      "displayName": "讲解视频制作",
      "description": "围绕明确主题制作讲解视频所需的脚本、分镜、旁白、视觉方案和质检结果。"
    }
  },
  "compatibility": {
    "agents": [
      "Codex",
      "Claude Code",
      "Cursor",
      "Gemini CLI"
    ],
    "runtime": [
      "Supplied media or artifact and an available local or approved production tool"
    ],
    "os": [
      "macOS",
      "Linux",
      "Windows"
    ]
  },
  "qualityGates": {
    "Q0": "scenario-and-upstream-evidence",
    "Q1": "passed",
    "Q2": "passed",
    "Q3": "passed",
    "Q4": "fixtures-ready",
    "Q5": "fixtures-ready",
    "Q6": "declared",
    "Q7": "experimental-release"
  },
  "stableBlockers": [
    "Run realistic task baseline",
    "Measure error and omission rates",
    "Collect domain-review feedback"
  ]
}
