{
  "schemaVersion": 2,
  "name": "spec-to-work-items",
  "path": "skills/work-management/spec-to-work-items",
  "version": "0.18.0",
  "stage": "experimental",
  "scenarioId": "decompose-spec-into-work-items",
  "origin": "xopc-adapted",
  "license": "MIT",
  "owner": "XOPC Skills Team",
  "source": "skills/work-management/spec-to-work-items/SOURCE.json",
  "localizations": {
    "en": {
      "displayName": "Spec to Work Items",
      "description": "Turn an approved product or engineering specification into small, independently verifiable work items with acceptance criteria, dependencies, and delivery order."
    },
    "zh-CN": {
      "displayName": "把产品规格拆成可交付工作项",
      "description": "形成纵向切片、依赖明确、可验收且经确认后才能写入系统的工作计划。"
    }
  },
  "compatibility": {
    "agents": [
      "Codex",
      "Claude Code",
      "Cursor",
      "Gemini CLI"
    ],
    "runtime": [
      "Git repository or supplied project artifacts"
    ],
    "os": [
      "macOS",
      "Linux",
      "Windows"
    ]
  },
  "qualityGates": {
    "Q0": "scenario-and-upstream-evidence",
    "Q1": "passed",
    "Q2": "passed",
    "Q3": "passed",
    "Q4": "fixtures-ready",
    "Q5": "fixtures-ready",
    "Q6": "declared",
    "Q7": "experimental-release"
  },
  "stableBlockers": [
    "Run realistic task baseline",
    "Measure error and omission rates",
    "Collect domain-review feedback"
  ]
}
