{"schemaVersion":2,"name":"mcp-server-builder","path":"skills/api-integration/mcp-server-builder","version":"0.18.2","stage":"experimental","scenarioId":"build-production-mcp-server","origin":"xopc-adapted","license":"Apache-2.0","owner":"XOPC Skills Team","source":"skills/api-integration/mcp-server-builder/SOURCE.json","localizations":{"en":{"displayName":"MCP Server Builder","description":"Design, implement, and evaluate an MCP server that exposes an external service through discoverable, bounded tools."},"zh-CN":{"displayName":"MCP Server 构建","description":"设计、实现并评估 MCP Server，让外部服务通过易发现、边界清楚且错误可恢复的工具供 Agent 使用。"}},"compatibility":{"agents":["Codex","Claude Code","Cursor","Gemini CLI"],"runtime":["Official MCP SDK and target service development environment"],"os":["macOS","Linux","Windows"]},"qualityGates":{"Q0":"upstream-and-scenario-evidence","Q1":"passed","Q2":"passed","Q3":"passed","Q4":"fixtures-ready","Q5":"fixtures-ready","Q6":"declared","Q7":"experimental-release"},"stableBlockers":["Run fresh-agent tool discovery benchmarks","Validate remote and stdio transports","Measure multi-step task completion"]}
