{
  "schemaVersion": 2,
  "name": "signup",
  "path": "skills/conversion-optimization/signup",
  "version": "0.18.2",
  "stage": "experimental",
  "scenarioId": "market-conversion-optimization",
  "origin": "xopc-adapted",
  "license": "MIT",
  "owner": "XOPC Skills Team",
  "source": "skills/conversion-optimization/signup/SOURCE.json",
  "localizations": {
    "en": {
      "displayName": "Signup Flow CRO",
      "description": "Optimize signup, registration, account creation, or trial activation flows."
    },
    "zh-CN": {
      "displayName": "注册流程优化",
      "description": "诊断并减少注册、开户和试用开通流程中的摩擦与流失。"
    }
  },
  "compatibility": {
    "agents": [
      "Codex",
      "Claude Code",
      "Cursor",
      "Gemini CLI"
    ],
    "runtime": [
      "No helper runtime required; web, analytics, media, or account tools are optional and task-dependent"
    ],
    "os": [
      "macOS",
      "Linux",
      "Windows"
    ]
  },
  "qualityGates": {
    "Q0": "provisional",
    "Q1": "passed",
    "Q2": "passed",
    "Q3": "passed",
    "Q4": "fixtures-ready",
    "Q5": "fixtures-ready",
    "Q6": "declared",
    "Q7": "experimental-release"
  },
  "stableBlockers": [
    "Run blind review on three representative real tasks",
    "Measure unsupported-claim and routing-error rates",
    "Validate platform-specific guidance and external-action recovery"
  ]
}
