{
  "schemaVersion": 2,
  "name": "json-canvas",
  "path": "skills/obsidian-authoring/json-canvas",
  "version": "0.18.3",
  "stage": "experimental",
  "scenarioId": "obsidian-authoring",
  "origin": "xopc-adapted",
  "license": "MIT",
  "owner": "XOPC Skills Team",
  "source": "skills/obsidian-authoring/json-canvas/SOURCE.json",
  "localizations": {
    "en": {
      "displayName": "JSON Canvas Skill",
      "description": "Create and edit JSON Canvas files (.canvas) with nodes, edges, groups, and connections."
    },
    "zh-CN": {
      "displayName": "Obsidian Canvas",
      "description": "创建和编辑包含节点、连线和分组的 Obsidian Canvas 文件。"
    }
  },
  "compatibility": {
    "agents": [
      "Codex",
      "Claude Code",
      "Cursor",
      "Gemini CLI"
    ],
    "runtime": [
      "No bundled credentials or service runtime; task-specific document, browser, file, or validation tools optional"
    ],
    "os": [
      "macOS",
      "Linux",
      "Windows"
    ]
  },
  "qualityGates": {
    "Q0": "provisional",
    "Q1": "passed",
    "Q2": "passed",
    "Q3": "passed",
    "Q4": "fixtures-ready",
    "Q5": "fixtures-ready",
    "Q6": "declared",
    "Q7": "experimental-release"
  },
  "stableBlockers": [
    "Blind-review three representative real tasks",
    "Measure routing, unsupported-claim, and validation-failure rates",
    "Verify target-runtime behavior and recovery paths"
  ]
}
