{
  "schemaVersion": 2,
  "name": "marketing-loops",
  "path": "skills/growth-distribution/marketing-loops",
  "version": "0.18.1",
  "stage": "experimental",
  "scenarioId": "market-growth-distribution",
  "origin": "xopc-adapted",
  "license": "MIT",
  "owner": "XOPC Skills Team",
  "source": "skills/growth-distribution/marketing-loops/SOURCE.json",
  "localizations": {
    "en": {
      "displayName": "Marketing Loops",
      "description": "Set up a recurring, self-running marketing workflow — a repeatable loop an AI agent runs on a cadence (weekly, daily, on a trigger) rather than a one-off task."
    },
    "zh-CN": {
      "displayName": "营销增长循环",
      "description": "把营销任务设计成可重复运行、可观测并带有停止规则的周期性工作流。"
    }
  },
  "compatibility": {
    "agents": [
      "Codex",
      "Claude Code",
      "Cursor",
      "Gemini CLI"
    ],
    "runtime": [
      "No helper runtime required; web, analytics, media, or account tools are optional and task-dependent"
    ],
    "os": [
      "macOS",
      "Linux",
      "Windows"
    ]
  },
  "qualityGates": {
    "Q0": "provisional",
    "Q1": "passed",
    "Q2": "passed",
    "Q3": "passed",
    "Q4": "fixtures-ready",
    "Q5": "fixtures-ready",
    "Q6": "declared",
    "Q7": "experimental-release"
  },
  "stableBlockers": [
    "Run blind review on three representative real tasks",
    "Measure unsupported-claim and routing-error rates",
    "Validate platform-specific guidance and external-action recovery"
  ]
}
