{
  "schemaVersion": 2,
  "name": "product-requirements-authoring",
  "path": "skills/product-requirements/product-requirements-authoring",
  "version": "0.18.0",
  "stage": "experimental",
  "scenarioId": "author-product-requirements",
  "origin": "xopc-original",
  "license": "MIT",
  "owner": "XOPC Skills Team",
  "localizations": {
    "en": {
      "displayName": "Product Requirements Authoring",
      "description": "Develop or revise a PRD from user problems, evidence and constraints before implementation breakdown."
    },
    "zh-CN": {
      "displayName": "产品需求文档",
      "description": "把用户问题与业务约束转化为范围明确、可验证并可供评审的 PRD。"
    }
  },
  "compatibility": {
    "agents": [
      "Codex",
      "Claude Code",
      "Cursor",
      "Gemini CLI"
    ],
    "runtime": [
      "Supplied product evidence and constraints"
    ],
    "os": [
      "macOS",
      "Linux",
      "Windows"
    ]
  },
  "qualityGates": {
    "Q0": "scenario-and-market-evidence",
    "Q1": "passed",
    "Q2": "source-reviewed-original",
    "Q3": "self-reviewed-boundaries",
    "Q4": "fixtures-ready",
    "Q5": "fixtures-ready",
    "Q6": "declared",
    "Q7": "experimental-release"
  },
  "stableBlockers": [
    "Run realistic task baseline and held-out trigger evaluation",
    "Complete independent domain review",
    "Verify target-product runtime compatibility"
  ]
}
