{"schemaVersion":2,"name":"validate-idea","path":"skills/one-person-company/validate-idea","version":"0.18.1","stage":"experimental","scenarioId":"validate-opc-idea","origin":"xopc-original","license":"MIT","owner":"XOPC Skills Team","localizations":{"en":{"displayName":"Validate Idea","description":"Test whether a specific one-person-company problem and offer deserve investment using interviews, behavior and payment evidence."},"zh-CN":{"displayName":"验证一人公司问题与付费意愿","description":"基于行为和交易证据作出继续、修正、补证或停止决策。"}},"compatibility":{"agents":["Codex","Claude Code","Cursor","Gemini CLI"],"runtime":["Problem, customer and validation evidence"],"os":["macOS","Linux","Windows"]},"qualityGates":{"Q0":"historical-xopc-scenario-recovery","Q1":"passed","Q2":"passed","Q3":"passed","Q4":"fixtures-ready","Q5":"fixtures-ready","Q6":"declared","Q7":"experimental-release"},"stableBlockers":["Run idea-validation baseline","Measure weak-signal overclaim rate","Complete customer-discovery review"]}
